{
  "schema_version": "0.1",
  "benchmark_id": "existing-cmt-hard-stress-v0.1",
  "task_id": "cmt-hard-research-8",
  "run_id": "hakimi_experimental_flags_ab_2026_06_05_clean_slice",
  "created_at": "2026-06-05T21:05:00+08:00",
  "score": {
    "passed": 0,
    "total": 4,
    "hard_score": 0.0,
    "unit": "item_mode_checks",
    "note": "The verifier full-score files list all 8 task fields; this audit scores only the two probed fields across two modes."
  },
  "summary": {
    "conclusion": "Hakimi 0.13.0 experimental flags change the runtime surface under the same DeepSeek model, but the two clean CMT probes do not show an accuracy win. Both modes failed both probed items; default ON had one JSON-emission failure and one partial answer, while flags OFF emitted JSON but produced wrong or source-contested answers.",
    "dominant_failure_modes": [
      "answer_accuracy",
      "model_behavior",
      "data_source",
      "harness"
    ],
    "json_emission_rate": 0.75,
    "answer_accuracy_rate": 0.0,
    "notes": [
      "default ON logged seven enabled experimental flags: physics-memory, research-ledger, research-action, domain-profile, workflow-recipe, research-harness, goal-command.",
      "flags OFF logged flags=[] after setting the default-on experimental flag environment variables to 0.",
      "Observed runtime surface changed from 25 tools to 20 tools and systemPromptChars dropped from the default-ON range to about 14689-14690 in flags-OFF runs.",
      "Problem 1 is source/gold high-risk and should not be used as clean model capability evidence until manually adjudicated.",
      "Earlier summary-writing hangs were attributed to PowerShell ConvertTo-Json pipeline behavior; the runner now uses ConvertTo-Json -InputObject."
    ]
  },
  "evidence_files": [
    "D:\\Playground\\agent-lab\\benchmarks\\existing-cmt-hard-stress-v0.1\\runs\\20260605-202807__hakimi013_deepseek_flags_ab__cmt_hard_research_8__p1_runner_fix_smoke4\\run-metadata.json",
    "D:\\Playground\\agent-lab\\benchmarks\\existing-cmt-hard-stress-v0.1\\runs\\20260605-202807__hakimi013_deepseek_flags_ab__cmt_hard_research_8__p1_runner_fix_smoke4\\outputs\\cmt-hard-research-8.default_on.json",
    "D:\\Playground\\agent-lab\\benchmarks\\existing-cmt-hard-stress-v0.1\\runs\\20260605-202807__hakimi013_deepseek_flags_ab__cmt_hard_research_8__p1_runner_fix_smoke4\\outputs\\cmt-hard-research-8.all_default_on_flags_off.json",
    "D:\\Playground\\agent-lab\\benchmarks\\existing-cmt-hard-stress-v0.1\\runs\\20260605-203143__hakimi013_deepseek_flags_ab__cmt_hard_research_8__p7_runner_fix_smoke\\run-metadata.json",
    "D:\\Playground\\agent-lab\\benchmarks\\existing-cmt-hard-stress-v0.1\\runs\\20260605-203143__hakimi013_deepseek_flags_ab__cmt_hard_research_8__p7_runner_fix_smoke\\outputs\\cmt-hard-research-8.default_on.json",
    "D:\\Playground\\agent-lab\\benchmarks\\existing-cmt-hard-stress-v0.1\\runs\\20260605-203143__hakimi013_deepseek_flags_ab__cmt_hard_research_8__p7_runner_fix_smoke\\outputs\\cmt-hard-research-8.all_default_on_flags_off.json",
    "D:\\Playground\\agent-lab\\benchmarks\\existing-cmt-hard-stress-v0.1\\tasks\\cmt-hard-research-8\\private\\gold.json",
    "D:\\Playground\\agent-lab\\benchmarks\\existing-cmt-hard-stress-v0.1\\source-cmt_data.jsonl",
    "D:\\Playground\\agent-lab\\benchmarks\\existing-cmt-hard-stress-v0.1\\run-hakimi-experimental-ab.ps1"
  ],
  "probes": [
    {
      "name": "experimental_flags_on_off_smoke",
      "changed_variable": "KIMI_CODE_EXPERIMENTAL_* environment flags",
      "result": "default ON logged seven enabled flags; all-default-on-flags-off logged flags=[].",
      "interpretation": "The A/B runner is exercising different Hakimi runtime configurations, not merely repeating the same setup.",
      "evidence_files": [
        "D:\\Playground\\agent-lab\\benchmarks\\existing-cmt-hard-stress-v0.1\\runs\\20260605-202807__hakimi013_deepseek_flags_ab__cmt_hard_research_8__p1_runner_fix_smoke4\\run-metadata.json",
        "D:\\Playground\\agent-lab\\benchmarks\\existing-cmt-hard-stress-v0.1\\runs\\20260605-203143__hakimi013_deepseek_flags_ab__cmt_hard_research_8__p7_runner_fix_smoke\\run-metadata.json"
      ]
    },
    {
      "name": "same_provider_model_smoke",
      "changed_variable": "none; provider/model held fixed",
      "result": "Both modes used Hakimi 0.13.0 with deepseek/deepseek-v4-pro from the local Hakimi config copied into isolated temp homes.",
      "interpretation": "The comparison isolates the experimental flag surface better than the earlier original-Kimi plan, because the provider/model is held constant.",
      "evidence_files": [
        "D:\\Playground\\agent-lab\\benchmarks\\existing-cmt-hard-stress-v0.1\\runs\\20260605-202807__hakimi013_deepseek_flags_ab__cmt_hard_research_8__p1_runner_fix_smoke4\\logs\\default_on.provider.stdout.txt",
        "D:\\Playground\\agent-lab\\benchmarks\\existing-cmt-hard-stress-v0.1\\runs\\20260605-202807__hakimi013_deepseek_flags_ab__cmt_hard_research_8__p1_runner_fix_smoke4\\logs\\all_default_on_flags_off.provider.stdout.txt"
      ]
    },
    {
      "name": "runner_summary_serialization_fix",
      "changed_variable": "PowerShell JSON serialization call",
      "result": "Earlier summary-writing hangs were resolved after changing the helper to ConvertTo-Json -InputObject.",
      "interpretation": "The previous hang was a harness serialization issue, not model inability or API quota exhaustion.",
      "evidence_files": [
        "D:\\Playground\\agent-lab\\benchmarks\\existing-cmt-hard-stress-v0.1\\run-hakimi-experimental-ab.ps1",
        "D:\\Playground\\agent-lab\\benchmarks\\existing-cmt-hard-stress-v0.1\\runs\\20260605-202807__hakimi013_deepseek_flags_ab__cmt_hard_research_8__p1_runner_fix_smoke4\\run-metadata.json",
        "D:\\Playground\\agent-lab\\benchmarks\\existing-cmt-hard-stress-v0.1\\runs\\20260605-203143__hakimi013_deepseek_flags_ab__cmt_hard_research_8__p7_runner_fix_smoke\\run-metadata.json"
      ]
    }
  ],
  "items": [
    {
      "item_id": "p1_default_on",
      "field": "cmt_vmc_rnn_gradient_choices",
      "source_index": 13,
      "mode": "default_on",
      "observed_failure": "Hakimi completed the item but the merged output JSON was empty; stdout contained a prose answer rather than a parseable JSON object.",
      "primary_category": "model_behavior",
      "secondary_categories": [
        "answer_accuracy",
        "data_source"
      ],
      "root_cause_hypothesis": "The model violated the benchmark output contract under default experimental flags. The prose answer appears to choose b, but because no JSON object was emitted this cannot be credited by the verifier. The underlying gold row is also source-risky.",
      "confidence": "high",
      "evidence": [
        {
          "kind": "file",
          "path": "D:\\Playground\\agent-lab\\benchmarks\\existing-cmt-hard-stress-v0.1\\runs\\20260605-202807__hakimi013_deepseek_flags_ab__cmt_hard_research_8__p1_runner_fix_smoke4\\outputs\\cmt-hard-research-8.default_on.json",
          "value": {}
        },
        {
          "kind": "metric",
          "value": {
            "runtime_seconds": 80.043,
            "stdout_bytes": 260,
            "stderr_bytes": 5777,
            "json_emitted": false
          }
        },
        {
          "kind": "score",
          "path": "D:\\Playground\\agent-lab\\benchmarks\\existing-cmt-hard-stress-v0.1\\runs\\20260605-202807__hakimi013_deepseek_flags_ab__cmt_hard_research_8__p1_runner_fix_smoke4\\scores\\cmt-hard-research-8.default_on.full-score.json",
          "value": {
            "expected": [
              "d",
              "e"
            ],
            "actual_parsed": []
          }
        }
      ],
      "actual": "prose answer b; no parseable JSON",
      "expected": [
        "d",
        "e"
      ],
      "passed": false,
      "json_emitted": false,
      "runtime_seconds": 80.043,
      "stdout_bytes": 260,
      "stderr_bytes": 5777,
      "recommended_action": "Strengthen the final output contract and rerun after adjudicating source index 13.",
      "retest_plan": "Rerun p1 default ON with the fixed runner and stricter final-JSON wording; separately review the source/gold row before scoring capability."
    },
    {
      "item_id": "p1_flags_off",
      "field": "cmt_vmc_rnn_gradient_choices",
      "source_index": 13,
      "mode": "all_default_on_flags_off",
      "observed_failure": "Hakimi emitted parseable JSON with answer b, but the gold expects d;e.",
      "primary_category": "data_source",
      "secondary_categories": [
        "answer_accuracy"
      ],
      "root_cause_hypothesis": "The item is not a clean capability failure because the prompt includes option b for the missing-baseline issue, a plausible standard criticism of the displayed VMC gradient estimator, while the source/gold row marks d;e.",
      "confidence": "medium",
      "evidence": [
        {
          "kind": "file",
          "path": "D:\\Playground\\agent-lab\\benchmarks\\existing-cmt-hard-stress-v0.1\\runs\\20260605-202807__hakimi013_deepseek_flags_ab__cmt_hard_research_8__p1_runner_fix_smoke4\\outputs\\cmt-hard-research-8.all_default_on_flags_off.json",
          "value": {
            "cmt_vmc_rnn_gradient_choices": "b"
          }
        },
        {
          "kind": "source",
          "path": "D:\\Playground\\agent-lab\\benchmarks\\existing-cmt-hard-stress-v0.1\\source-cmt_data.jsonl",
          "value": {
            "source_index": 13,
            "solution": "$\\boxed{d;e}$",
            "noted_prompt_option": "b. The gradient estimator is biased because it misses a baseline involving the average energy."
          }
        },
        {
          "kind": "metric",
          "value": {
            "runtime_seconds": 80.051,
            "stdout_bytes": 327,
            "stderr_bytes": 9685,
            "json_emitted": true
          }
        }
      ],
      "actual": [
        "b"
      ],